{
  "project_key": "github.com/mschwar/project-ledger",
  "display_name": "Project Ledger",
  "description": "Project-reality compiler for distributed project sources, typed observations, and evolving canonical identity.",
  "status": "active",
  "tags": [
    "ledger",
    "git",
    "tooling"
  ],
  "canonical_url": "https://github.com/mschwar/project-ledger.git",
  "repo_name": "project-ledger",
  "shared": true,
  "storage_scope": "shared",
  "last_session_at": "2026-10-30T15:57:00Z",
  "last_session_summary": "Promoted all 29 queued Batch 2 frontier triage candidate decisions into registry/identity-decisions.json (62 approved triage candidates, 65 total durable decisions), consolidating live canonical projects 190 -> 176 across 214 observations with 0 open identity reviews and 0 untriaged cross-project weak overlaps; all 143 unit tests passing with P5.1 source checkpointing active.",
  "next_step": "Reconcile multi-checkout preferred-location tie-breaking (e.g. active feature-branch checkouts in /central/repos/active vs idle main checkouts in secondary roots like /central/repos/apps/steam-db-mattified) or retire duplicate legacy checkouts (/central/repos/apps/steam-db-mattified, gbrain-candidate/gbrain-master, /central/projects/song-clean) and wire machina/homelab pre-spawn drift checks to `ledger resolve --json`.",
  "last_push_at": ""
}
